{
  "schema": "seed.conformance.seed_conformance_bindings.v1",
  "identity_positions": {
    "00000000-0000-7000-8000-00000000a001": {
      "block_height": 0,
      "event_index": 0
    },
    "00000000-0000-7000-8000-00000000a002": {
      "block_height": 5,
      "event_index": 0
    },
    "00000000-0000-7000-8000-00000000a004": {
      "block_height": 0,
      "event_index": 1
    }
  },
  "idea_positions": {
    "00000000-0000-7000-8000-00000000b001": {
      "idea_type": "conceptual_idea",
      "block_height": 0,
      "event_index": 2
    },
    "00000000-0000-7000-8000-00000000b002": {
      "idea_type": "conceptual_idea",
      "block_height": 0,
      "event_index": 3
    },
    "00000000-0000-7000-8000-00000000b003": {
      "idea_type": "conceptual_idea",
      "block_height": 5,
      "event_index": 1
    }
  },
  "vectors": [
    {
      "id": "SCB-001",
      "description": "The separate title slot carries no description-tier or vocabulary fields.",
      "events": [
        {
          "id": "00000000-0000-7000-8000-00000000e001",
          "kind": "representation_create",
          "speaker_identity_id": "00000000-0000-7000-8000-00000000a001",
          "block_height": 2,
          "event_index": 0,
          "payload": {
            "representation_id": "00000000-0000-7000-8000-00000000d001",
            "target_kind": "idea",
            "target_object_id": "00000000-0000-7000-8000-00000000c001",
            "representation_kind": "title",
            "payload_hash": "1111111111111111111111111111111111111111111111111111111111111111",
            "author_identity_id": "00000000-0000-7000-8000-00000000a001"
          }
        }
      ],
      "expected": {
        "accept": true,
        "code": null
      }
    },
    {
      "id": "SCB-002",
      "description": "All three lengths by four complexities form exactly twelve valid description cells.",
      "events": [
        {
          "id": "00000000-0000-7000-8000-00000000e010",
          "kind": "representation_create",
          "speaker_identity_id": "00000000-0000-7000-8000-00000000a001",
          "block_height": 2,
          "event_index": 1,
          "payload": {
            "representation_id": "00000000-0000-7000-8000-00000000d010",
            "target_kind": "idea",
            "target_object_id": "00000000-0000-7000-8000-00000000c001",
            "representation_kind": "description",
            "tier_length": "sentence",
            "tier_complexity": "fundamental",
            "payload_hash": "1111111111111111111111111111111111111111111111111111111111111111",
            "author_identity_id": "00000000-0000-7000-8000-00000000a001"
          }
        },
        {
          "id": "00000000-0000-7000-8000-00000000e011",
          "kind": "representation_create",
          "speaker_identity_id": "00000000-0000-7000-8000-00000000a001",
          "block_height": 2,
          "event_index": 2,
          "payload": {
            "representation_id": "00000000-0000-7000-8000-00000000d011",
            "target_kind": "idea",
            "target_object_id": "00000000-0000-7000-8000-00000000c001",
            "representation_kind": "description",
            "tier_length": "sentence",
            "tier_complexity": "standard",
            "payload_hash": "1111111111111111111111111111111111111111111111111111111111111111",
            "author_identity_id": "00000000-0000-7000-8000-00000000a001"
          }
        },
        {
          "id": "00000000-0000-7000-8000-00000000e012",
          "kind": "representation_create",
          "speaker_identity_id": "00000000-0000-7000-8000-00000000a001",
          "block_height": 2,
          "event_index": 3,
          "payload": {
            "representation_id": "00000000-0000-7000-8000-00000000d012",
            "target_kind": "idea",
            "target_object_id": "00000000-0000-7000-8000-00000000c001",
            "representation_kind": "description",
            "tier_length": "sentence",
            "tier_complexity": "advanced",
            "payload_hash": "1111111111111111111111111111111111111111111111111111111111111111",
            "author_identity_id": "00000000-0000-7000-8000-00000000a001"
          }
        },
        {
          "id": "00000000-0000-7000-8000-00000000e013",
          "kind": "representation_create",
          "speaker_identity_id": "00000000-0000-7000-8000-00000000a001",
          "block_height": 2,
          "event_index": 4,
          "payload": {
            "representation_id": "00000000-0000-7000-8000-00000000d013",
            "target_kind": "idea",
            "target_object_id": "00000000-0000-7000-8000-00000000c001",
            "representation_kind": "description",
            "tier_length": "sentence",
            "tier_complexity": "canonical",
            "vocabulary_version_id": "00000000-0000-7000-8000-00000000b001",
            "payload_hash": "1111111111111111111111111111111111111111111111111111111111111111",
            "author_identity_id": "00000000-0000-7000-8000-00000000a001"
          }
        },
        {
          "id": "00000000-0000-7000-8000-00000000e014",
          "kind": "representation_create",
          "speaker_identity_id": "00000000-0000-7000-8000-00000000a001",
          "block_height": 2,
          "event_index": 5,
          "payload": {
            "representation_id": "00000000-0000-7000-8000-00000000d014",
            "target_kind": "idea",
            "target_object_id": "00000000-0000-7000-8000-00000000c001",
            "representation_kind": "description",
            "tier_length": "paragraph",
            "tier_complexity": "fundamental",
            "payload_hash": "1111111111111111111111111111111111111111111111111111111111111111",
            "author_identity_id": "00000000-0000-7000-8000-00000000a001"
          }
        },
        {
          "id": "00000000-0000-7000-8000-00000000e015",
          "kind": "representation_create",
          "speaker_identity_id": "00000000-0000-7000-8000-00000000a001",
          "block_height": 2,
          "event_index": 6,
          "payload": {
            "representation_id": "00000000-0000-7000-8000-00000000d015",
            "target_kind": "idea",
            "target_object_id": "00000000-0000-7000-8000-00000000c001",
            "representation_kind": "description",
            "tier_length": "paragraph",
            "tier_complexity": "standard",
            "payload_hash": "1111111111111111111111111111111111111111111111111111111111111111",
            "author_identity_id": "00000000-0000-7000-8000-00000000a001"
          }
        },
        {
          "id": "00000000-0000-7000-8000-00000000e016",
          "kind": "representation_create",
          "speaker_identity_id": "00000000-0000-7000-8000-00000000a001",
          "block_height": 2,
          "event_index": 7,
          "payload": {
            "representation_id": "00000000-0000-7000-8000-00000000d016",
            "target_kind": "idea",
            "target_object_id": "00000000-0000-7000-8000-00000000c001",
            "representation_kind": "description",
            "tier_length": "paragraph",
            "tier_complexity": "advanced",
            "payload_hash": "1111111111111111111111111111111111111111111111111111111111111111",
            "author_identity_id": "00000000-0000-7000-8000-00000000a001"
          }
        },
        {
          "id": "00000000-0000-7000-8000-00000000e017",
          "kind": "representation_create",
          "speaker_identity_id": "00000000-0000-7000-8000-00000000a001",
          "block_height": 2,
          "event_index": 8,
          "payload": {
            "representation_id": "00000000-0000-7000-8000-00000000d017",
            "target_kind": "idea",
            "target_object_id": "00000000-0000-7000-8000-00000000c001",
            "representation_kind": "description",
            "tier_length": "paragraph",
            "tier_complexity": "canonical",
            "vocabulary_version_id": "00000000-0000-7000-8000-00000000b001",
            "payload_hash": "1111111111111111111111111111111111111111111111111111111111111111",
            "author_identity_id": "00000000-0000-7000-8000-00000000a001"
          }
        },
        {
          "id": "00000000-0000-7000-8000-00000000e018",
          "kind": "representation_create",
          "speaker_identity_id": "00000000-0000-7000-8000-00000000a001",
          "block_height": 2,
          "event_index": 9,
          "payload": {
            "representation_id": "00000000-0000-7000-8000-00000000d018",
            "target_kind": "idea",
            "target_object_id": "00000000-0000-7000-8000-00000000c001",
            "representation_kind": "description",
            "tier_length": "full",
            "tier_complexity": "fundamental",
            "payload_hash": "1111111111111111111111111111111111111111111111111111111111111111",
            "author_identity_id": "00000000-0000-7000-8000-00000000a001"
          }
        },
        {
          "id": "00000000-0000-7000-8000-00000000e019",
          "kind": "representation_create",
          "speaker_identity_id": "00000000-0000-7000-8000-00000000a001",
          "block_height": 2,
          "event_index": 10,
          "payload": {
            "representation_id": "00000000-0000-7000-8000-00000000d019",
            "target_kind": "idea",
            "target_object_id": "00000000-0000-7000-8000-00000000c001",
            "representation_kind": "description",
            "tier_length": "full",
            "tier_complexity": "standard",
            "payload_hash": "1111111111111111111111111111111111111111111111111111111111111111",
            "author_identity_id": "00000000-0000-7000-8000-00000000a001"
          }
        },
        {
          "id": "00000000-0000-7000-8000-00000000e020",
          "kind": "representation_create",
          "speaker_identity_id": "00000000-0000-7000-8000-00000000a001",
          "block_height": 2,
          "event_index": 11,